{
  "kind": "vhplan-sap-receipt",
  "version": 1,
  "orderGuid": "3f2b8c1e-9d4a-4e6b-8a7c-5d1e2f3a4b5c",
  "orderFile": "MP0133_20261002-084233.json",
  "planSpId": 138,
  "planId": "MP0133",
  "state": "Created",
  "sapSystem": "GQ1",
  "sapClient": "450",
  "sapPlanNo": "30001234",
  "lockedBy": "EKSEM",
  "lockedOn": "2026-10-02T11:02:10",
  "updatedOn": "2026-10-02T11:05:12",
  "finishedOn": "2026-10-02T11:05:12",
  "items": [
    {
      "spId": 185,
      "itemId": "MI0179",
      "taskListType": "A",
      "taskListGroup": "50012345",
      "taskListCounter": "1",
      "sapItemNo": "120045",
      "longTextDone": true
    },
    {
      "spId": 186,
      "itemId": "MI0180",
      "taskListType": "A",
      "taskListGroup": "50012346",
      "taskListCounter": "1",
      "sapItemNo": "120046",
      "longTextDone": true
    }
  ],
  "warnings": [
    "MI0179, operation 170: 1 materiale er ikke oprettet automatisk. Tilføj det i IA06 på arbejdsplan 50012345."
  ],
  "lastError": null,
  "log": [
    { "at": "2026-10-02T11:02:10", "text": "Start (GQ1/450, EKSEM)" },
    { "at": "2026-10-02T11:02:41", "text": "MI0179: arbejdsplan 50012345/1 oprettet" },
    { "at": "2026-10-02T11:03:02", "text": "MI0179: position 120045 oprettet" },
    { "at": "2026-10-02T11:03:15", "text": "MI0179: langtekst uploadet" },
    { "at": "2026-10-02T11:03:49", "text": "MI0180: arbejdsplan 50012346/1 oprettet" },
    { "at": "2026-10-02T11:04:07", "text": "MI0180: position 120046 oprettet" },
    { "at": "2026-10-02T11:04:19", "text": "MI0180: langtekst uploadet" },
    { "at": "2026-10-02T11:05:12", "text": "Plan 30001234 oprettet" }
  ]
}
